{"$id":"https://closy.local/schemas/v1/closy-blueprint-truth-overlay-successor-v1.schema.json","$schema":"https://json-schema.org/draft/2020-12/schema","additionalProperties":false,"properties":{"budgetStateBeforeSuccessorAuthority":{"type":"object"},"consumerPolicy":{"type":"string"},"coverage":{"type":"object"},"externalExactHeadAttestations":{"type":"array"},"historicalFieldPolicy":{"type":"object"},"nextAction":{"type":"string"},"overlayDigest":{"pattern":"^[0-9a-f]{64}$","type":"string"},"overlayVersion":{"const":"closy.blueprint_truth_overlay.successor.v1"},"researchPrototype":{"type":"object"},"schemaVersion":{"const":1},"scopeSeparation":{"type":"object"},"unitSSuccessor":{"type":"object"},"unitT":{"type":"object"},"unitU":{"type":"object"}},"required":["schemaVersion","overlayVersion","consumerPolicy","historicalFieldPolicy","coverage","researchPrototype","unitT","unitU","budgetStateBeforeSuccessorAuthority","unitSSuccessor","scopeSeparation","externalExactHeadAttestations","nextAction","overlayDigest"],"title":"Closy blueprint truth overlay successor v1","type":"object"}
